{
  "schema_version": "1.0",
  "run_id": "run-20260822T211500Z-a1b2c3",
  "experiment_id": "audio-visualizer",
  "micro_rush_id": "rush-audio-input",
  "status": "completed",
  "started_at": "2026-08-22T21:15:00+02:00",
  "finished_at": "2026-08-22T21:42:00+02:00",
  "branch": "agent/rush-audio-input",
  "commit_before": "abcdef1",
  "commit_after": "1234567",
  "artifacts_dir": "runs/run-20260822T211500Z-a1b2c3",
  "stop_reason": null,
  "success": {
    "process": true,
    "protocol": true,
    "task": true,
    "report": true
  }
}

